{
  "$schema": "https://json-schema.org/draft/2020-12/schema",
  "$id": "https://acp.dev/schemas/v1/tool-server.schema.json",
  "title": "ToolServerRecord",
  "description": "server.json-style publication record for one governed MCP tool server (tool-integration.md): tools with scopes and risk classes, owning team, wrapped system of record, data classification, rate limits, and deprecation. INTERNAL catalog only — it names scope vocabulary and SoR topology, so it is served on authenticated registry routes and never on the public A2A edge. Secrets are NEVER stored: auth.credential_ref is an env/vault KEY NAME expanded at the tool gateway.",
  "type": "object",
  "required": [
    "id",
    "url",
    "version",
    "owning_team",
    "wrapped_sor",
    "data_classification",
    "auth",
    "tools",
    "rate_limit"
  ],
  "additionalProperties": false,
  "properties": {
    "id": { "type": "string", "pattern": "^[a-z][a-z0-9-]*$" },
    "url": { "type": "string", "format": "uri" },
    "version": {
      "type": "string",
      "pattern": "^(0|[1-9]\\d*)\\.(0|[1-9]\\d*)\\.(0|[1-9]\\d*)(-[0-9A-Za-z.-]+)?$",
      "description": "Semver of the published tool contract."
    },
    "owning_team": {
      "type": "string",
      "minLength": 1,
      "description": "Accountable human team (no ownerless tool servers)."
    },
    "wrapped_sor": {
      "type": "string",
      "minLength": 1,
      "description": "The system of record this server wraps (e.g. the ITSM, the cloud estate)."
    },
    "data_classification": {
      "type": "string",
      "enum": ["public", "internal", "confidential", "restricted"]
    },
    "auth": {
      "type": "object",
      "required": ["mode"],
      "additionalProperties": false,
      "properties": {
        "mode": {
          "type": "string",
          "enum": ["credential-ref", "token-exchange"],
          "description": "credential-ref: the gateway brokers a static credential resolved from credential_ref at startup. token-exchange: RFC 8693 exchange toward audience/scope."
        },
        "credential_ref": {
          "type": "string",
          "pattern": "^[A-Z][A-Z0-9_]*$",
          "description": "Env/vault KEY NAME (e.g. ACP_TOOL_CRED_CLOUD_ESTATE) — never the secret value."
        },
        "header": {
          "type": "string",
          "minLength": 1,
          "description": "Header the brokered credential is sent in; defaults to x-acp-broker-credential."
        },
        "audience": { "type": "string", "minLength": 1 },
        "scope": { "type": "array", "items": { "type": "string" } }
      }
    },
    "tools": {
      "type": "array",
      "minItems": 1,
      "items": { "$ref": "#/$defs/tool" },
      "description": "The allowlist AND scope map: a tool absent here cannot be called through the gateway."
    },
    "rate_limit": { "$ref": "#/$defs/rate_limit" },
    "tool_rate_limits": {
      "type": "object",
      "additionalProperties": { "$ref": "#/$defs/rate_limit" },
      "description": "Per-tool overrides; tools not named fall back to rate_limit."
    },
    "deprecation": {
      "type": "object",
      "required": ["deprecated"],
      "additionalProperties": false,
      "properties": {
        "deprecated": { "type": "boolean" },
        "sunset_at": { "type": "string", "format": "date-time" },
        "replaced_by": { "type": "string", "pattern": "^[a-z][a-z0-9-]*$" }
      }
    },
    "timeout_ms": { "type": "integer", "minimum": 1 }
  },
  "$defs": {
    "tool": {
      "type": "object",
      "required": ["name", "scope", "risk"],
      "additionalProperties": false,
      "properties": {
        "name": { "type": "string", "pattern": "^[a-z][a-z0-9_]*$" },
        "description": { "type": "string" },
        "scope": {
          "type": "string",
          "pattern": "^[a-z][a-z0-9-]*(:[a-z][a-z0-9_-]*)+$",
          "description": "Delegated scope a caller must hold for Cedar to permit the call."
        },
        "risk": {
          "type": "string",
          "enum": ["R0", "R1", "R2", "R3"],
          "description": "Side-effect risk: R0 read, R1 draft, R2 write-gated, R3 write-auto."
        },
        "input_schema": {
          "type": "object",
          "description": "JSON Schema 2020-12 for the tool input (informational; the gateway validates live)."
        },
        "output_schema": {
          "type": "object",
          "description": "JSON Schema 2020-12 for the tool output (informational; the gateway validates live)."
        }
      }
    },
    "rate_limit": {
      "type": "object",
      "required": ["per_minute", "burst"],
      "additionalProperties": false,
      "properties": {
        "per_minute": { "type": "number", "exclusiveMinimum": 0 },
        "burst": { "type": "number", "minimum": 1 }
      }
    }
  }
}
